Information for device 397-D Scale (VID=0x0D8F PID=0x0200):

Connection Information:
------------------------------
Device current bus speed: LowSpeed
Device address: 0x0006
Current configuration value: 0x00
Number of open pipes: 0

Device Descriptor:
------------------------------
0x12	bLength
0x01	bDescriptorType
0x0200	bcdUSB
0x00	bDeviceClass      
0x00	bDeviceSubClass   
0x00	bDeviceProtocol   
0x08	bMaxPacketSize0   (8 bytes)
0x0D8F	idVendor
0x0200	idProduct
0x0100	bcdDevice
0x01	iManufacturer   "Pitney Bowes"
0x02	iProduct   "397-D Scale"
0x04	iSerialNumber   "3K25210006489"
0x01	bNumConfigurations

Configuration Descriptor:
------------------------------
0x09	bLength
0x02	bDescriptorType
0x0022	wTotalLength   (34 bytes)
0x01	bNumInterfaces
0x01	bConfigurationValue
0x00	iConfiguration
0x80	bmAttributes   (Bus-powered Device)
0x20	bMaxPower      (64 mA)

Interface Descriptor:
------------------------------
0x09	bLength
0x04	bDescriptorType
0x00	bInterfaceNumber
0x00	bAlternateSetting
0x01	bNumEndPoints
0x03	bInterfaceClass      (Human Interface Device Class)
0x00	bInterfaceSubClass   
0x00	bInterfaceProtocol   
0x03	iInterface   "00-000"

HID Descriptor:
------------------------------
0x09	bLength
0x21	bDescriptorType
0x0101	bcdHID
0x00	bCountryCode
0x01	bNumDescriptors
0x22	bDescriptorType   (Report descriptor)
0x00DD	bDescriptorLength

Endpoint Descriptor:
------------------------------
0x07	bLength
0x05	bDescriptorType
0x81	bEndpointAddress  (IN endpoint 1)
0x03	bmAttributes      (Transfer: Interrupt / Synch: None / Usage: Data)
0x0008	wMaxPacketSize    (1 x 8 bytes)
0xC8	bInterval         (200 frames)

Microsoft OS Descriptor is not available. Error code: 0x0000001F

String Descriptor Table
--------------------------------
Index  LANGID  String
0x00   0x0000  0x0409 
0x01   0x0409  "Pitney Bowes"
0x02   0x0409  "397-D Scale"
0x04   0x0409  "3K25210006489"
0x03   0x0409  "00-000"

------------------------------

Connection path for device: 
Intel(R) 8 Series USB Enhanced Host Controller #1 - 9C26
Root Hub
Generic USB Hub
397-D Scale (VID=0x0D8F PID=0x0200) Port: 4

Running on: Windows 7 with Service Pack 1

Brought to you by TDD v2.12.0, Aug  2 2019, 16:35:05
