Information for device USB Optical Mouse (VID=0x0461 PID=0x4E22):

Connection Information:
------------------------------
Device current bus speed: LowSpeed
Device address: 0x0006
Current configuration value: 0x00
Number of open pipes: 0

Device Descriptor:
------------------------------
0x12	bLength
0x01	bDescriptorType
0x0200	bcdUSB
0x00	bDeviceClass      
0x00	bDeviceSubClass   
0x00	bDeviceProtocol   
0x08	bMaxPacketSize0   (8 bytes)
0x0461	idVendor
0x4E22	idProduct
0x0100	bcdDevice
0x01	iManufacturer
0x02	iProduct
0x00	iSerialNumber
0x01	bNumConfigurations

Configuration Descriptor:
------------------------------
0x09	bLength
0x02	bDescriptorType
0x0022	wTotalLength   (34 bytes)
0x01	bNumInterfaces
0x01	bConfigurationValue
0x00	iConfiguration
0xA0	bmAttributes   (Bus-powered Device, Remote-Wakeup)
0x32	bMaxPower      (100 mA)

Interface Descriptor:
------------------------------
0x09	bLength
0x04	bDescriptorType
0x00	bInterfaceNumber
0x00	bAlternateSetting
0x01	bNumEndPoints
0x03	bInterfaceClass      (Human Interface Device Class)
0x01	bInterfaceSubClass   
0x02	bInterfaceProtocol   
0x00	iInterface

HID Descriptor:
------------------------------
0x09	bLength
0x21	bDescriptorType
0x0111	bcdHID
0x00	bCountryCode
0x01	bNumDescriptors
0x22	bDescriptorType   (Report descriptor)
0x002E	bDescriptorLength

Endpoint Descriptor:
------------------------------
0x07	bLength
0x05	bDescriptorType
0x81	bEndpointAddress  (IN endpoint 1)
0x03	bmAttributes      (Transfer: Interrupt / Synch: None / Usage: Data)
0x0004	wMaxPacketSize    (1 x 4 bytes)
0x0A	bInterval         (10 frames)

Microsoft OS Descriptor is not available. Error code: 0x0000001F

String Descriptor Table
--------------------------------
Index  LANGID  String
0x00   0x0000  
0x01   0x0000  "PixArt"
0x02   0x0000  "USB Optical Mouse"

------------------------------

Connection path for device: 
Intel(R) 8 Series USB Enhanced Host Controller #1 - 9C26
Root Hub
Generic USB Hub
USB Optical Mouse (VID=0x0461 PID=0x4E22) Port: 2

Running on: Windows 7 with Service Pack 1

Brought to you by TDD v2.12.0, Aug  2 2019, 16:35:05
